nombre;descripcion;estrellas;ciudad;pais;lat;lon;chef;tipo_cocina_1
Shang-High Cuisine;The dining room is furnished in a modern Chinese style;1;Shanghai;China Mainland;31.23491;121.480586;;Shanghainese
Seventh Son;The Hong Kong based chain opened this comfortable, traditionally decorated;1;Shanghai;China Mainland;31.219598;121.460072;;Cantonese
Seventh Son;This outpost of the Hong Kong group is conveniently located;1;Beijing;China Mainland;39.910984;116.452361;;Cantonese
Rêver;With stunning river views and a calming ambience, Rêver lives;1;Guangzhou;China Mainland;23.109474;113.331346;;French Contemporary
Ren He Guan (Zhaojiabang Road);Dim yellow lights, a nostalgic décor, 1930s memorabilia, golden oldies;1;Shanghai;China Mainland;31.203604;121.453734;;Shanghainese
Poetry?Wine (Dongsanhuan Middle Road);The bamboo bush, jade ornaments, ink paintings and cut flowers;1;Beijing;China Mainland;39.897639;116.454715;;Beijing Cuisine
Phénix;In 2021, the French chef who took the helm brought;1;Shanghai;China Mainland;31.223997;121.44368;;French
Oriental Sense & Palate;A historic European mansion is home to this three-storey;1;Shanghai;China Mainland;31.216671;121.464255;;Chao Zhou
Opera Bombana;Umberto Bombana stunned the world with his 8 1/2;1;Beijing;China Mainland;39.919746;116.44863;;Italian
Obscura;Its chiaroscuro ring logo connotes completeness and the complementary relationship;1;Shanghai;China Mainland;31.236348;121.442233;;Innovative
Moose (Pudong);There are two branches of Moose in Shanghai and both;1;Shanghai;China Mainland;31.230604;121.51517;;Huaiyang
Moose (Changning);While antique furniture and oil paintings complement the refurbished century;1;Shanghai;China Mainland;31.20189;121.4297;;Huaiyang
Mio;Despite its discreet entrance, this lavishly ornate dining room will;1;Beijing;China Mainland;39.95071;116.4672;;Italian
Ming Court;Weary travellers will find this airy dining room near Hongqiao;1;Shanghai;China Mainland;31.19512;121.31633;;Cantonese
Mi Xun Teahouse;Nestled in a quiet hotel next to Daci Temple, this;1;Chengdu;China Mainland;30.654727;104.081984;;Vegetarian
Meet the Bund;Brass ceiling panels and chandeliers lends a touch of nostalgic;1;Shanghai;China Mainland;31.228818;121.493593;;Fujian
Ma's Kitchen;This hugely popular shop in the bustling Taikoo Li area;1;Chengdu;China Mainland;30.653874;104.081227;;Sichuan
Lu Style (Anding Road);Instead of typical Shandong classics, this native chef from the;1;Beijing;China Mainland;39.977857;116.398637;;Shandong
Lingnan House;Since October 2019, diners have been flocking here for Chef;1;Guangzhou;China Mainland;23.119891;113.320629;;Cantonese
Ling Long;The dining room feels airy, minimal and fresh, with just;1;Beijing;China Mainland;39.931781;116.454401;;Innovative
Lei Garden (Yuexiu);This may be an outpost of the Hong Kong-based;1;Guangzhou;China Mainland;23.136923;113.279568;;Cantonese
Lei Garden (Xuhui);The chain may be spreading rapidly in Asia but quality;1;Shanghai;China Mainland;31.218122;121.454124;;Cantonese
Lei Garden (Pudong);Reservations are a must as this branch of the chain;1;Shanghai;China Mainland;31.238373;121.49761;;Cantonese
Sheng Yong Xing;The Beijing brand famous for Peking duck chose this prestigious;1;Shanghai;China Mainland;31.236447;121.486181;;Beijing Cuisine
Lei Garden (Jinbao Tower);Lei Garden hails from Hong Kong and specialises in traditional;1;Beijing;China Mainland;39.9109245;116.4133837;;Cantonese
Sheng Yong Xing (Chaoyang);This east-meets-west décor melds Jiangnan motifs and furniture;1;Beijing;China Mainland;39.939223;116.443748;;Beijing Cuisine
Sir Elly's;The French chef is well-versed in European classics that;1;Shanghai;China Mainland;31.235736;121.450915;;European Contemporary
Yu Zhi Lan;There’s no sign at this discreet restaurant, but a;1;Shanghai;China Mainland;31.218916;121.449455;;Sichuan
Yu Yue Heen;Helmed by Chef Mai who boasts over 30 years of;1;Guangzhou;China Mainland;23.119916;113.317995;;Cantonese
YongFoo Élite;The building dates from 1930 and was the British Consulate;1;Shanghai;China Mainland;31.211227;121.43842;;Shanghainese
Yong Yi Ting;It may be located beneath a hotel but this tastefully;1;Shanghai;China Mainland;31.245216;121.50343;;Shanghainese
Yong Fu;Shanghainese are no strangers to Ningbo cuisine and can be;1;Shanghai;China Mainland;31.220526;121.46027;;Ningbo
Yi Long Court;Though styled after the golden era of old Shanghai circa;1;Shanghai;China Mainland;31.243758;121.507579;;Cantonese
Xu's Cuisine;This was the first restaurant of the chain and has;1;Chengdu;China Mainland;30.639715;104.086383;;Sichuan
Xin Rong Ji (West Nanjing Road);Among the four branches in Shanghai, this location and the;1;Shanghai;China Mainland;31.23138;121.46432;;Taizhou
Xin Rong Ji (Jinrong Street);This is the first Beijing branch of the Taizhou brand;1;Beijing;China Mainland;39.917499;116.353313;;Taizhou
Xin Rong Ji (Jianguomenwai Street);Having started life as a small shop selling seafood dishes;1;Beijing;China Mainland;39.906171;116.453263;;Taizhou
Wisca (Haizhu);The chain started life as a stall and opened this;1;Guangzhou;China Mainland;23.110752;113.254258;;Cantonese
Vege Wonder;If you crave taro fish or chicken nuggets made with;1;Beijing;China Mainland;39.911324;116.402415;;Vegetarian
The Tasty House;Nestled in Jing Yard, a tree-lined entertainment and dining;1;Beijing;China Mainland;39.930362;116.452431;;Jiangzhe
The Georg;Tucked in a restored riverside quadrangle house, Georg Jensen’s;1;Beijing;China Mainland;39.934451;116.39889;;European Contemporary
Tea Culture (East Beijing Road);You can tell from its name that the restaurant is;1;Shanghai;China Mainland;31.22318;121.464502;;Huaiyang
T'ang Court;The dining room with six smartly dressed tables may seem;1;Shanghai;China Mainland;31.208949;121.445604;;Cantonese
Suyab Courtyard?Pickmoon Gourmet;This building houses a furniture store, a restaurant and a;1;Guangzhou;China Mainland;23.024632;113.32637;;Chao Zhou
Song Yun Ze;Zhang Songyun is a legendary Sichuanese chef and his protégés;1;Chengdu;China Mainland;30.622636;104.089499;;Sichuan
Song;Christened after the dynasty and the owner’s last name;1;Guangzhou;China Mainland;23.12226;113.321903;;Sichuan
Silver Pot;The owner’s collection of souvenirs from her trips around;1;Chengdu;China Mainland;30.5856;104.056593;;Sichuan
Zhiguan Courtyard;This restaurant, annexed to an art gallery, sports a dining;1;Beijing;China Mainland;39.91405;116.409091;;Dongbei
Le Patio & La Famille (Huangpu);The first time you come to this restaurant you may;1;Shanghai;China Mainland;31.237719;121.484375;;Hang Zhou
Lao Ji Tang (Gongrentiyuchang South Road);This exceptionally skilled kitchen team hails from a time-honoured;1;Beijing;China Mainland;39.925181;116.442599;;Shanghainese
Chaimen Hui;A premium brand of the chain, Chaimen Hui goes for;1;Chengdu;China Mainland;30.584093;104.053347;;Sichuan
Canton Table;Remodelled in 2019, the room exudes old-Shanghai flair with;1;Shanghai;China Mainland;31.236093;121.486211;;Cantonese
Cai Yi Xuan;Having worked with various teams within the hotel group for;1;Beijing;China Mainland;39.948977;116.461067;;Cantonese
BingSheng Private Kitchen;This décor re-creates the old-time charm of luxury;1;Guangzhou;China Mainland;23.137287;113.328901;;Cantonese
BingSheng Mansion;This main dining room and its 32 private rooms exude;1;Guangzhou;China Mainland;23.117404;113.322958;;Cantonese
Amazing Chinese Cuisine (Changning);This restaurant excels at high-end Chao Zhou cuisine, ranging;1;Shanghai;China Mainland;31.202995;121.3889;;Chao Zhou
Cheng Long Hang (Huangpu);A household name among hairy crab lovers, this restaurant runs;1;Shanghai;China Mainland;31.239067;121.48161;;Shanghainese
Lao Zheng Xing (Huangpu);Known locally and internationally since its inception in 1862, Lao;1;Shanghai;China Mainland;31.235098;121.475464;;Shanghainese
Chengdu Restaurant;The hanging lamps are a nod to the Golden Sun;1;Chengdu;China Mainland;30.618011;104.064047;;Cantonese
Cui Hua Lou (Chongwenmenwai Street);Now a chain with four branches, this long-standing brand;1;Beijing;China Mainland;39.897672;116.411131;;Shandong
Lai Heen;Lai Heen champions modern Cantonese cooking deeply rooted in tradition;1;Guangzhou;China Mainland;23.11883;113.321816;;Cantonese
Jing Yaa Tang;In a serene hotel amidst the busy Sanlitun area, this;1;Beijing;China Mainland;39.9404737;116.4615173;;Beijing Cuisine
Jing;What this basement dining room lacks in scenery, it more;1;Beijing;China Mainland;39.915588;116.416395;;French Contemporary
Jin Xuan;Right next to the iconic Oriental Pearl Tower is this;1;Shanghai;China Mainland;31.238417;121.498024;;Cantonese
Jean Georges;Another dining concept from chef Vongerichten, Jean Georges features smart;1;Shanghai;China Mainland;31.218637;121.490738;;French
Jade River;Diners here unwind with a cup of tea freshly brewed;1;Guangzhou;China Mainland;23.108321;113.237649;;Cantonese
In Love (Gongti East Road);This is a Hunanese restaurant, but its décor easily passes;1;Beijing;China Mainland;39.927315;116.443233;;Hunanese
Imperial Treasure Fine Teochew Cuisine;The Singapore-based chain opened its first outpost here in;1;Guangzhou;China Mainland;23.137162;113.327751;;Chao Zhou
Huaiyang Fu;This period mansion, complete with a stone garden, brick walls;1;Beijing;China Mainland;39.95238;116.402769;;Huaiyang
Hongtu Hall;Besides river views and stunning murals, Hongtu Hall is prized;1;Guangzhou;China Mainland;23.108321;113.237649;;Dim Sum
Furong;Named after the provincial flower of Hunan, it makes perfect;1;Beijing;China Mainland;39.916154;116.35324;;Hunanese
Fu He Hui;Exuding Zen-inspired serenity, the room reflects a philosophy that;1;Shanghai;China Mainland;31.22046;121.425095;;Vegetarian
Fu Chun Ju;Designed by the German architect Ole Scheeren, this dining room;1;Beijing;China Mainland;39.922423;116.403739;;Cantonese
Fu 1088;A beautiful tiled entrance, wood panelling and striking light fittings;1;Shanghai;China Mainland;31.230693;121.468529;;Shanghainese
Fu 1015;The villa’s small rooms may be furnished in an;1;Shanghai;China Mainland;31.218564;121.429009;;Shanghainese
Fang Xiang Jing;Sitting nicely in a Japanese stone garden, this three-storey;1;Chengdu;China Mainland;30.685754;104.051369;;Sichuan
Famous Cuisine (Tianhe);The founder has been in the business for over 40;1;Guangzhou;China Mainland;23.144325;113.31722;;Cantonese
Country Kitchen;While this room commands panoramic vistas, your attention may be;1;Beijing;China Mainland;39.918808;116.454181;;Beijing Cuisine
Zijin Mansion;Though its name means purple and gold, this cosy dining;1;Beijing;China Mainland;39.916259;116.414122;;Cantonese
Yu Zhi Lan;This low-key dining concept doesn’t need a sign;2;Chengdu;China Mainland;30.669182;104.055887;;Sichuan
Xin Rong Ji (Xinyuan South Road);This branch of the chain restaurant opened in 2019 and;3;Beijing;China Mainland;39.94638;116.450148;;Taizhou
Xin Rong Ji (Nanyang Road);Apart from the elegant interior, the biggest draw of this;2;Shanghai;China Mainland;31.22789;121.45071;;Taizhou
Taian Table;If creative, refined dining with a modern twist is your;2;Guangzhou;China Mainland;23.138026;113.280695;;European Contemporary
Chao Shang Chao;Setting foot in this upmarket restaurant with 17 private rooms;2;Beijing;China Mainland;39.910992;116.461892;;Chao Zhou
Canton 8 (Runan Street);This is the place to go for quality dim sum;2;Shanghai;China Mainland;31.204708;121.47799;;Cantonese
Bao Li Xuan;The Bvlgari Hotel’s Chinese restaurant is nestled in an;2;Shanghai;China Mainland;31.242798;121.482315;;Cantonese
8 ½ Otto e Mezzo Bombana;The third restaurant under the aegis of chef Umberto Bombana;2;Shanghai;China Mainland;31.244394;121.48346;;Italian
L'ATELIER de Joël Robuchon;As with other branches around the world, this one boasts;2;Shanghai;China Mainland;31.239767;121.4854;;French Contemporary
Jingji;Jingji is the portmanteau of ‘Beijing’ and ‘Yueji’, the official;2;Beijing;China Mainland;39.910623;116.4856;;Beijing Cuisine
Jiang by Chef Fei;This elegant and relaxing décor shows a harmonious confluence of;2;Guangzhou;China Mainland;23.137134;113.327867;;Cantonese
Ji Pin Court;This oasis in the bustling city centre serves traditional Cantonese;2;Shanghai;China Mainland;31.206108;121.448654;;Cantonese
Imperial Treasure Fine Chinese Cuisine (Huangpu);This restaurant from the Singaporean group is furnished in a;2;Shanghai;China Mainland;31.22318;121.464502;;Cantonese
Imperial Treasure Fine Chinese Cuisine;As in other branches of this Singapore-based chain, the;2;Guangzhou;China Mainland;23.118473;113.326514;;Cantonese
King's Joy;Just a stone’s throw from Yonghe Temple, this upmarket;3;Beijing;China Mainland;39.946681;116.410004;Gary YIN;Vegetarian
The Beijing Kitchen;With over 20 years of experience, this owner-chef from;1;Beijing;China Mainland;39.909316;116.473274;Chi Fai KU;Cantonese
Maison Lameloise;The first Asian outpost of its namesake in Burgundy is;1;Shanghai;China Mainland;31.235929;121.500972;Eric Pras;French Contemporary
Le Comptoir de Pierre Gagnaire;An appealing, remodelled Shanghai villa – part of the Capella Hotel;1;Shanghai;China Mainland;31.221621;121.459782;Romain CHAPEL;French
Il Ristorante - Niko Romito;Stunning vistas of Pudong skyline, floating crystal chandeliers and semi;1;Shanghai;China Mainland;31.229977;121.48704;Mauro ALOISIO;Italian
Il Ristorante - Niko Romito;This dining concept by the eponymous Milanese chef epitomises all;1;Beijing;China Mainland;39.947719;116.452232;Niko ROMITO;Italian
Family Li Imperial Cuisine (Xicheng);Since 1985, this restaurant has been serving food truly fit;1;Beijing;China Mainland;39.939837;116.376926;Aiyin LI;Beijing Cuisine
Da Dong (Xuhui);Most customers come for the signature roast duck, boasting wonderfully;1;Shanghai;China Mainland;31.230507;121.437471;Zhen Xiang DONG;Chinese Contemporary
Da Dong (Jingan);Like its sister, this Da Dong has a bright and;1;Shanghai;China Mainland;31.225245;121.44289;Zhen Xiang DONG;Chinese Contemporary
Da Dong (Dongsi 10th Alley);In business since 2006, this two-storey branch of the;1;Beijing;China Mainland;39.93026;116.424984;Zhen Xiang DONG;Chinese Contemporary
Shanghai Cuisine;This cosy and understated dining room is adorned in neutral;2;Beijing;China Mainland;39.930881;116.453254;Frank, Hai Feng ZHU;Shanghainese
Da Vittorio;The Da Vittorio family have been serving seafood in Brusaporto;2;Shanghai;China Mainland;31.229464;121.492954;Stefano BACCHELLI;Italian
Ultraviolet by Paul Pairet;This multi-sensory experience at a secret location that combines;3;Shanghai;China Mainland;31.240358;121.48509;Paul PAIRET;Innovative
Taian Table;A fixture on the city’s dining scene since 2016;3;Shanghai;China Mainland;31.221807;121.474049;Stefan STILLER;Innovative
