nombre;descripcion;estrellas;ciudad;pais;lat;lon;chef;tipo_cocina_1
8 1/2 Otto e Mezzo - Bombana;Owner-chef Umberto Bombana’s restaurant oozes Italian charm and;3;Hong Kong;Hong Kong;22.2814635;114.15867;Umberto BOMBANA;Italian
Caprice;One of the most glamorous and elegant restaurants in Hong;3;Hong Kong;Hong Kong;22.2866489;114.1566097;Guillaume GALLIOT;French Contemporary
Forum;The iconic dish here, Ah Yat braised abalone, has become;3;Hong Kong;Hong Kong;22.2813972;114.1821905;Lung To WONG;Cantonese
Lung King Heen;For many, the roast Peking duck alone is reason enough;3;Hong Kong;Hong Kong;22.2860122;114.1580538;Yan Tak CHAN;Cantonese
Sushi Shikon;The famous sushi-ya moved to this prestigious address in;3;Hong Kong;Hong Kong;22.2806103;114.1577893;Yoshiharu KAKINUMA;Sushi
T'ang Court;It’s easy to see why this restaurant remains so;3;Hong Kong;Hong Kong;22.296572;114.1698;Wai Keung KWONG;Cantonese
Amber;There has been a radical revamp at this restaurant helmed;2;Hong Kong;Hong Kong;22.2805311;114.1577065;Richard EKKEBUS;French Contemporary
Arbor;Calming Mediterranean colours make this place something of an oasis;2;Hong Kong;Hong Kong;22.283146;114.15542;Eric RÄTY;Innovative
Bo Innovation;Alvin Leung celebrates Hong Kong’s culture, traditions and people;2;Hong Kong;Hong Kong;22.2763009;114.1710473;Alvin LEUNG;Innovative
L'Envol;Managed by Chef Olivier Elzer, L’Envol is elegantly furnished;2;Hong Kong;Hong Kong;22.2799005;114.1761315;Olivier ELZER;French Contemporary
Octavium;The chic, minimalistic dining room is a befitting lead-in;2;Hong Kong;Hong Kong;22.2825493;114.1571177;Umberto BOMBANA;Italian
Sun Tung Lok;Synonymous with top-quality Cantonese cooking, Sun Tung Lok spares;2;Hong Kong;Hong Kong;22.30099;114.17221;Joe, Yung CHAN;Cantonese
Ta Vie;The mantra of chef Hideaki Sato is “pure, simple and;2;Hong Kong;Hong Kong;22.282766;114.15529;Hideaki SATO;Innovative
Tate;Owner-chef Vicky Lau tells edible stories with a six;2;Hong Kong;Hong Kong;22.2855757;114.1477192;Vicky LAU;Innovative
Tin Lung Heen;Aptly named ‘sky dragon pavilion’ in Chinese, this grand restaurant;2;Hong Kong;Hong Kong;22.3032802;114.1598747;Paul, Ping Lui LAU;Cantonese
Yan Toh Heen;The location may be somewhat concealed but it’s well;2;Hong Kong;Hong Kong;22.293337;114.17395;Yiu Fai LAU;Cantonese
Ying Jee Club;Rather than gimmicky promotions, the owner prefers to divert his;2;Hong Kong;Hong Kong;22.284338;114.156654;Hin Chi SIU;Cantonese
Écriture;Plenty of creativity went into the design of this understated;2;Hong Kong;Hong Kong;22.2831268;114.1552862;Maxime GILBERT;French Contemporary
And?;Born in Argentina but having honed his skills in Japan;1;Hong Kong;Hong Kong;22.2817911;114.1553834;Agustin Ferrando BALBI;Innovative
Arcane;Aussie chef Shane Osborn lets diners witness how quality ingredients;1;Hong Kong;Hong Kong;22.2806189;114.1567744;Shane OSBORN;European Contemporary
Beefbar;This branch of the Monte Carlo-based group boasts stylish;1;Hong Kong;Hong Kong;22.2800634;114.1576634;Andrea SPAGONI;Steakhouse
Fu Ho;Thanks to his considerable experience, the head chef has been;1;Hong Kong;Hong Kong;22.3006247;114.1720828;Sam CHENG;Cantonese
Gaddi's;This grand restaurant opened in 1953 and now occupies what;1;Hong Kong;Hong Kong;22.294992;114.17179;Albin GOBIL;French
Louise;Chef Julien Royer, of Odette in Singapore fame, opened this;1;Hong Kong;Hong Kong;22.2834752;114.1522258;Julien ROYER;French Contemporary
Man Ho (Admiralty);After a major makeover in 2019, Man Ho now welcomes;1;Hong Kong;Hong Kong;22.2776712;114.1659424;Jayson, Ka Ho TANG;Cantonese
Mandarin Grill + Bar;This stylish room designed by the late Sir Terence Conran;1;Hong Kong;Hong Kong;22.2821483;114.1593485;Robin ZAVOUS;European Contemporary
Ming Court (Mong Kok);Diners are greeted at the door by the dazzling collection;1;Hong Kong;Hong Kong;22.318314;114.16933;Yuet Faat LI;Cantonese
New Punjab Club;This tandoor grill restaurant serving cuisine from Northern India is;1;Hong Kong;Hong Kong;22.28005;114.15525;Palash MITRA;Indian
Petrus;Heavy drapes at the windows, thick carpets and elegantly laid;1;Hong Kong;Hong Kong;22.27746;114.16434;Uwe OPOCENSKY;French
Roganic;Roganic is the brainchild of British chef Simon Rogan. With;1;Hong Kong;Hong Kong;22.2813924;114.1821991;Oliver MARLOW;European Contemporary
Ryota Kappou Modern;Floor-to-ceiling windows let in natural light and allow;1;Hong Kong;Hong Kong;22.2806182;114.156779;Ryota KANESAWA;Japanese
Rùn;Chef Hung has worked in many 5-star hotel restaurants;1;Hong Kong;Hong Kong;22.2801399;114.175716;Chi Kwong HUNG;Cantonese
Spring Moon;The room, spread over two levels, evokes old-Shanghai circa;1;Hong Kong;Hong Kong;22.294943;114.17182;Yuk Ming LAM;Cantonese
Summer Palace;There’s a timeless, exotic feel to this room whose;1;Hong Kong;Hong Kong;22.2770061;114.1644721;Yu King LEUNG;Cantonese
Sushi Saito;Supervised and managed by famed Chef Takashi Saito, the team;1;Hong Kong;Hong Kong;22.286467;114.15677;Masashi KUBOTA;Sushi
Takumi by Daisuke Mori;Named after its executive chef from Japan, this restaurant features;1;Hong Kong;Hong Kong;22.2766457;114.1772288;Daisuke MORI;Innovative
The Araki;Helmed by Mitsuhiro Araki himself, The Araki is the second;1;Hong Kong;Hong Kong;22.2957587;114.1697935;Mitsuhiro ARAKI;Sushi
Tosca di Angelo;The Sicilian chef champions dishes that may look deceptively unfussy;1;Hong Kong;Hong Kong;22.3032095;114.1599308;Angelo AGLIANÓ;Italian
Vea;An impressive counter and open kitchen dominate the room and;1;Hong Kong;Hong Kong;22.2850013;114.1529424;Vicky CHENG;Innovative
Yardbird;Yardbird moved here in 2017 and since then, it is;1;Hong Kong;Hong Kong;22.2869992;114.1492298;Matt ABERGEL;Yakitori
Yat Tung Heen;The dining room boasts dark wood panels and moody lighting;1;Hong Kong;Hong Kong;22.3080802;114.1717998;Tung TAM;Cantonese
Zest by Konishi;With its name that embodies freshness and seasonality, this two;1;Hong Kong;Hong Kong;22.2806256;114.1567709;Mitsuru KONISHI;French Contemporary
Zhejiang Heen;The oversized Xihu picture on its wall is hard to;1;Hong Kong;Hong Kong;22.2787;114.17763;Kau Long POON;Zhejiang
Zuicho;The head chef worked in some revered establishments in Tokyo;1;Hong Kong;Hong Kong;22.2850591;114.1521406;Fumio SUZUKI;Japanese
Épure;Have a drink on the terrace of this professionally run;1;Hong Kong;Hong Kong;22.2960349;114.1683295;Nicolas BOUTIN;French Contemporary
L'ATELIER de Joël Robuchon;If you want to feel part of the action sit;3;Hong Kong;Hong Kong;22.281199;114.15816;;French Contemporary
Aaharn;Bright yellow walls and modern art may not say much;1;Hong Kong;Hong Kong;22.2816498;114.1538558;;Thai
Belon;Belon moved to this spot in 2021, with a room;1;Hong Kong;Hong Kong;22.2830193;114.1525511;;French
Chaat;‘Chaat’ means ‘to lick’ in Hindi, as the food;1;Hong Kong;Hong Kong;22.2947649;114.1757148;;Indian
Duddell's;Duddell’s is as much about art as it is;1;Hong Kong;Hong Kong;22.2801227;114.1572052;;Cantonese
Fook Lam Moon (Wan Chai);With 70+ years of glorious history, Fook Lam Moon is;1;Hong Kong;Hong Kong;22.2768816;114.1708815;;Cantonese
Hansik Goo;‘Hansik’ means Korean food and ‘goo’ refers to Chef;1;Hong Kong;Hong Kong;22.2850215;114.1528913;;Korean
Ho Hung Kee (Causeway Bay);No discussion about Hong Kong’s historic noodle shops would;1;Hong Kong;Hong Kong;22.2799312;114.1837574;;Noodles and Congee
I M Teppanyaki & Wine;The founder and head chef Mok moved his restaurant to;1;Hong Kong;Hong Kong;22.2841392;114.1918676;;Teppanyaki
Imperial Treasure Fine Chinese Cuisine (Tsim Sha Tsui);Finding success in Singapore and Shanghai, Imperial Treasure opened its;1;Hong Kong;Hong Kong;22.296177;114.170006;;Cantonese
Jardin de Jade (Wan Chai);The first Hong Kong venture from this renowned Shanghai restaurant;1;Hong Kong;Hong Kong;22.280532;114.1769077;;Shanghainese
Kam's Roast Goose;For over 70 years, the Kams have been famous for;1;Hong Kong;Hong Kong;22.2777963;114.1755582;;Cantonese Roast Meats
Liu Yuan Pavilion;With its authentic Shanghainese cooking and Shanghainese-speaking clientele, it;1;Hong Kong;Hong Kong;22.2781199;114.1707918;;Shanghainese
Loaf On;It may not boast fancy displays of seafood like its;1;Hong Kong;Hong Kong;22.379858;114.27188;;Seafood
Man Wah;Following a 2020 makeover, this elegant and neo-Chinese chic;1;Hong Kong;Hong Kong;22.282213;114.15951;;Cantonese
Mono;The Venezuelan chef serves a tasting menu that reinterprets LatAm;1;Hong Kong;Hong Kong;22.2805997;114.1567846;;Latin American
Pang's Kitchen;A household name since 2001, this restaurant wins the hearts;1;Hong Kong;Hong Kong;22.26921;114.18452;;Cantonese
Seventh Son;The name refers to the owner – the seventh son who;1;Hong Kong;Hong Kong;22.2783246;114.1710507;;Cantonese
Shang Palace;This elegant restaurant has been a reliable favourite for classic;1;Hong Kong;Hong Kong;22.297325;114.177155;;Cantonese
Sushi Wadatsumi;The longstanding sushi fixture in Sheung Wan moved to this;1;Hong Kong;Hong Kong;22.29504;114.17497;;Sushi
The Chairman;Showing respect for the mostly organic ingredients from small suppliers;1;Hong Kong;Hong Kong;22.28444;114.15297;;Cantonese
Whey;Championing a zero-waste philosophy and committed to local sustainable;1;Hong Kong;Hong Kong;22.2850438;114.1529127;;European Contemporary
Xin Rong Ji;Taizhou cuisine emphasises the natural flavours of ingredients, which are;1;Hong Kong;Hong Kong;22.278013;114.17273;;Taizhou
Yat Lok;Founded in 1957, this family business has been running at;1;Hong Kong;Hong Kong;22.2825486;114.1552639;;Cantonese Roast Meats
Yong Fu;The first outpost of this Shanghai-based brand in Hong;1;Hong Kong;Hong Kong;22.2782025;114.169856;;Ningbo
Yè Shanghai (Tsim Sha Tsui);It may have moved to a swanky mall in 2020;1;Hong Kong;Hong Kong;22.294118;114.1741651;;Shanghainese
